<?xml version="1.0" encoding="utf-8"?>
<RootNode xmlns:xsi="http://www.w3.org/2001/XMLSchema-instance" xsi:noNamespaceSchemaLocation="../../GlobalSyntax.xsd">
    <AbstractNode Name="TypeSyntax">
        <AbstractNode Name="NameSyntax">
            <AbstractNode Name="SimpleNameSyntax">
                <Members>
                    <Member Type="SyntaxTokenInternal" Name="Identifier" />
                </Members>
                <Node Name="IdentifierNameSyntax" Kind="IdentifierName" />
            </AbstractNode>
            <Node Name="QualifiedNameSyntax" Kind="QualifiedName">
                <Members>
                    <Member Type="NameSyntax" Name="Left" />
                    <Member Type="SyntaxTokenInternal" Name="DotToken">
                        <Kinds>
                            <Kind>DotToken</Kind>
                        </Kinds>
                    </Member>
                    <Member Type="SimpleNameSyntax" Name="Right" />
                </Members>
            </Node>
        </AbstractNode>
    </AbstractNode>
    <AbstractNode Name="ExpressionSyntax">
        <Node Name="LiteralExpressionSyntax" Kind="NumericLiteralExpression StringLiteralExpression">
            <Members>
                <Member Type="SyntaxToken" Name="Token">
                    <Kinds>
                        <Kind>NumericLiteralToken</Kind>
                        <Kind>StringLiteralToken</Kind>
                    </Kinds>
                </Member>
            </Members>
        </Node>
        <Node Name="TextureLiteralExpressionSyntax" Kind="TextureLiteralExpression">
            <Members>
                <Member Type="LiteralExpressionSyntax" Name="Value" />
                <Member Type="SyntaxToken" Name="OpenBraceToken">
                    <Kinds>
                        <Kind>OpenBraceToken</Kind>
                    </Kinds>
                </Member>
                <Member Type="SyntaxToken" Name="CloseBraceToken">
                    <Kinds>
                        <Kind>CloseBraceToken</Kind>
                    </Kinds>
                </Member>
            </Members>
        </Node>
    </AbstractNode>
    <AbstractNode Name="BasePassDeclarationSyntax">
        <Members>
            <Member Type="SyntaxToken" Name="Keyword" />
        </Members>
        <Node Name="PassDeclarationSyntax" Kind="PassDeclaration">
            <Members>
                <Member Type="SyntaxToken" Name="Keyword">
                    <Kinds>
                        <Kind>PassKeyword</Kind>
                    </Kinds>
                </Member>
                <Member Type="SyntaxToken" Name="OpenBraceToken">
                    <Kinds>
                        <Kind>OpenBraceToken</Kind>
                    </Kinds>
                </Member>
                <Member Type="TagsDeclarationSyntax" Name="Tags" Nullable="true" />
                <Member Type="BaseCommandDeclarationSyntax" Name="Commands" List="Sequenced" />
                <Member Type="CgProgramDeclarationSyntax" Name="CgProgram" />
                <Member Type="SyntaxToken" Name="CloseBraceToken">
                    <Kinds>
                        <Kind>CloseBraceToken</Kind>
                    </Kinds>
                </Member>
            </Members>
        </Node>
        <Node Name="GrabPassDeclarationSyntax" Kind="GrabPassDeclaration">
            <Members>
                <Member Type="SyntaxToken" Name="Keyword">
                    <Kinds>
                        <Kind>GrabPassKeyword</Kind>
                    </Kinds>
                </Member>
                <Member Type="SyntaxToken" Name="OpenBraceToken">
                    <Kinds>
                        <Kind>OpenBraceToken</Kind>
                    </Kinds>
                </Member>
                <Member Type="SyntaxToken" Name="Identifier" Nullable="true">
                    <Kinds>
                        <Kind>IdentifierToken</Kind>
                    </Kinds>
                </Member>
                <Member Type="TagsDeclarationSyntax" Name="Tags" Nullable="true" />
                <Member Type="NameDeclarationSyntax" Name="Name" Nullable="true" />
                <Member Type="SyntaxToken" Name="CloseBraceToken">
                    <Kinds>
                        <Kind>CloseBraceToken</Kind>
                    </Kinds>
                </Member>
            </Members>
        </Node>
        <Node Name="UsePassDeclarationSyntax" Kind="UsePassDeclaration">
            <Members>
                <Member Type="SyntaxToken" Name="Keyword">
                    <Kinds>
                        <Kind>UsePassKeyword</Kind>
                    </Kinds>
                </Member>
                <Member Type="SyntaxToken" Name="PassReference">
                    <Kinds>
                        <Kind>StringLiteralToken</Kind>
                    </Kinds>
                </Member>
            </Members>
        </Node>
    </AbstractNode>
    <AbstractNode Name="BaseCommandDeclarationSyntax">
        <Members>
            <Member Type="SyntaxToken" Name="Keyword" />
        </Members>
        <Node Name="CommandDeclarationSyntax" Kind="CommandDeclaration">
            <Members>
                <Member Type="SyntaxToken" Name="Keyword">
                    <Kinds>
                        <Kind>IdentifierToken</Kind>
                    </Kinds>
                </Member>
                <Member Type="IdentifierNameSyntax" Name="Arguments" List="Separated" />
            </Members>
        </Node>
        <Node Name="StencilDeclarationSyntax" Kind="StencilDeclaration">
            <Members>
                <Member Type="SyntaxToken" Name="Keyword">
                    <Kinds>
                        <Kind>StencilKeyword</Kind>
                    </Kinds>
                </Member>
                <Member Type="SyntaxToken" Name="OpenBraceToken">
                    <Kinds>
                        <Kind>OpenBraceToken</Kind>
                    </Kinds>
                </Member>
                <Member Type="CommandDeclarationSyntax" Name="Commands" List="Sequenced" />
                <Member Type="SyntaxToken" Name="CloseBraceToken">
                    <Kinds>
                        <Kind>CloseBraceToken</Kind>
                    </Kinds>
                </Member>
            </Members>
        </Node>
        <Node Name="NameDeclarationSyntax" Kind="NameDeclaration">
            <Members>
                <Member Type="SyntaxToken" Name="Keyword">
                    <Kinds>
                        <Kind>NameKeyword</Kind>
                    </Kinds>
                </Member>
                <Member Type="SyntaxToken" Name="Name">
                    <Kinds>
                        <Kind>StringLiteralToken</Kind>
                    </Kinds>
                </Member>
            </Members>
        </Node>
    </AbstractNode>
    <Node Name="EqualsValueClauseSyntax" Kind="EqualsValueClause">
        <Members>
            <Member Type="SyntaxToken" Name="EqualsToken">
                <Kinds>
                    <Kind>EqualsToken</Kind>
                </Kinds>
            </Member>
            <Member Type="ExpressionSyntax" Name="Value" />
        </Members>
    </Node>
    <Node Name="ArgumentListSyntax" Kind="ArgumentList">
        <Members>
            <Member Type="SyntaxToken" Name="OpenParenToken">
                <Kinds>
                    <Kind>OpenParenToken</Kind>
                </Kinds>
            </Member>
            <Member Type="ArgumentSyntax" Name="Arguments" List="Separated" />
            <Member Type="SyntaxToken" Name="CloseParenToken">
                <Kinds>
                    <Kind>CloseParenToken</Kind>
                </Kinds>
            </Member>
        </Members>
    </Node>
    <Node Name="ArgumentSyntax" Kind="Argument">
        <Members>
            <Member Type="ExpressionSyntax" Name="Expression" />
        </Members>
    </Node>
    <Node Name="AttributeListSyntax" Kind="AttributeList">
        <Members>
            <Member Type="SyntaxToken" Name="OpenBracketToken">
                <Kinds>
                    <Kind>OpenBracketToken</Kind>
                </Kinds>
            </Member>
            <Member Type="AttributeSyntax" Name="Attributes" List="Separated" />
            <Member Type="SyntaxToken" Name="CloseBracketToken">
                <Kinds>
                    <Kind>CloseBracketToken</Kind>
                </Kinds>
            </Member>
        </Members>
    </Node>
    <Node Name="AttributeSyntax" Kind="Attribute">
        <Members>
            <Member Type="NameSyntax" Name="Name" />
            <Member Type="ArgumentListSyntax" Name="ArgumentList" Nullable="true" />
        </Members>
    </Node>
    <Node Name="CompilationUnitSyntax" Kind="CompilationUnit">
        <Members>
            <Member Type="ShaderDeclarationSyntax" Name="ShaderDeclaration" />
            <Member Type="SyntaxToken" Name="EndOfFileToken">
                <Kinds>
                    <Kind>EndOfFileToken</Kind>
                </Kinds>
            </Member>
        </Members>
    </Node>
    <Node Name="ShaderDeclarationSyntax" Kind="ShaderDeclaration">
        <Members>
            <Member Type="SyntaxToken" Name="ShaderKeyword">
                <Kinds>
                    <Kind>ShaderKeyword</Kind>
                </Kinds>
            </Member>
            <Member Type="SyntaxToken" Name="Identifier">
                <Kinds>
                    <Kind>StringLiteralToken</Kind>
                </Kinds>
            </Member>
            <Member Type="SyntaxToken" Name="OpenBraceToken">
                <Kinds>
                    <Kind>OpenBraceToken</Kind>
                </Kinds>
            </Member>
            <Member Type="PropertiesDeclarationSyntax" Name="Properties" Nullable="true" />
            <Member Type="CgIncludeDeclarationSyntax" Name="CgInclude" Nullable="true" />